{
  "header": {
    "object_id": "lsr_00000001",
    "object_type": "LearningSearchRecord",
    "object_version": "0.1.0",
    "created_at": "2026-04-24T19:55:00Z",
    "created_by_contributor_id": "system.alexandrian",
    "created_by_role": "system",
    "status": "draft",
    "policy_tags": ["learning-loop", "search", "evidence-first"]
  },
  "source": "ALEXANDRIAN_ACADEMY",
  "entity_type": "LEARNING_ACTION_EXPLANATION",
  "title": "Why next learning action was recommended",
  "text": "Review cited evidence span before attempting the next assessment item. This action is grounded in standards, evidence anchors, memory context, Sherlock retrieval, Oracle evaluation records, Moirai governance state, and policy checks.",
  "target_ref": "llr_00000001",
  "evidence_ref_ids": ["ariadne.span.example.0001"],
  "memory_ref_ids": ["memory-mesh://learning-context/example-0001"],
  "search_ref_ids": ["sherlock://learning-search/example-0001"],
  "governance_ref_ids": ["oracle://evaluation/example-0001", "moirai://changeset/example-0001", "policy-fabric://decision/example-0001"],
  "agentplane_run_ref_ids": ["agentplane://run/example-0001"],
  "final_score": 1.0
}
